{"acceptance":{"accepted_at_utc":null,"accepting_commit":null,"human_accepter":null,"reason":"current inventory includes later additions or modifications, so no immutable per-asset human acceptance fact was inferred","source":"FEATURES.json:LA records family-level Lane A acceptance at c8ee84d and 218aaea but does not prove every current byte","state":"unknown_per_current_byte"},"final_files":[{"bytes":425,"path":"res://assets/sprites/tile_elevated.png","sha256":"c5b2ad2ff3796ad114b1face15f5b815e3b0ee8fb9df70b3559576b054f9eeac"}],"generation":{"generation_id":null,"model":null,"provider":null,"seed":null,"unsupported_reason":"deterministic hand-authored project generator; stochastic provider fields do not apply"},"license":{"human_contribution":"selection, pixel recipes, palette, normalization, and accepted Lane A arrangement","source":"hand-authored deterministic pixel recipes in repository","spdx":"LicenseRef-Project-Owned"},"logical_id":"tile_elevated","migration":{"baseline_commit":"975261e8e00a20a0b25fe17e7976d743d509c14b","baseline_tree":"cf4b3e1c0d8ae826c668765d994a032acbb8c0ad","migrated_at_utc":null,"status":"current_bytes_authenticated"},"recipe":{"command":"godot --headless --path . -s tools/gen_assets.gd","generator_path":"res://tools/gen_assets.gd","generator_sha256":"80b4a9bfd528b98bebbb13765664b59e3101d674177f15b510158107cc344c6a","godot_version":"4.7.1.stable.official.a13da4feb"},"schema_version":1,"source_files":[{"bytes":6816,"path":"res://assets/asset_manifest.gd","sha256":"7148c49fe10153585be0de7e84fb664955803422621f9040bca6f9e98fa9eae2"},{"bytes":12728,"path":"res://tools/gen_assets.gd","sha256":"80b4a9bfd528b98bebbb13765664b59e3101d674177f15b510158107cc344c6a"},{"bytes":6799,"path":"res://tools/pixel/art_tiles.gd","sha256":"7f4c872aafccd546a9b54b40c3f73265c8f553b87014236e1a3146f6809b75fa"},{"bytes":2949,"path":"res://tools/pixel/palette.gd","sha256":"69664ccdc79bae343c04a6a58ae7614279b49dbb3fa5ecfd4b5d8319cff4d115"},{"bytes":7454,"path":"res://tools/pixel/pix.gd","sha256":"e5d059fb6d20c142f5d32c95c2bf8777f0fe7faf7f864395b8735b3b4e11a88b"}],"source_type":"deterministic_project_generator"}
