{"acceptance":{"accepted_at_utc":"2026-08-12T19:49:51Z","accepting_commit":"60b69a6004a9c843851d9f6c9aee84c88389cb1f","human_accepter":"Poseidon","reason":"Poseidon approved the exact AUI-10R revision-2 in-game candidate after overview and focused visual review","source":"docs/media/AUI-10R-REVISION-2-HUMAN-APPROVAL.json","state":"human_final_accepted"},"final_files":[{"bytes":594,"path":"res://assets/world/s1/s1-core-landmark.png","sha256":"8d6276cc05dc04c78cb62b6b998388962d657cc417f28dbeeb3b715a08446787"}],"generation":{"generation_id":null,"model":"gpt-image-2","provider":"OpenAI","seed":null,"unsupported_reason":"service does not expose a stable seed; accepted concepts and production source are hash-pinned"},"license":{"human_contribution":"direction, selection, revision verdicts, pixel normalization contracts, and exact-candidate final-art acceptance","source":"original GPT Image 2 concepts and project-controlled deterministic normalization","spdx":"LicenseRef-Project-Owned"},"logical_id":"world.s1.core_landmark","migration":{"baseline_commit":"975261e8e00a20a0b25fe17e7976d743d509c14b","baseline_tree":"cf4b3e1c0d8ae826c668765d994a032acbb8c0ad","migrated_at_utc":null,"status":"new_runtime_asset_authenticated"},"recipe":{"command":"python3 tools/art_pipeline/world/normalize_s1_world.py && python3 tools/art_pipeline/world/generate_s1_revision_v2.py","generator_path":"res://tools/art_pipeline/world/generate_s1_revision_v2.py","generator_sha256":"1bfd3a2d2dcd35627a3f5d97462e06a8155100823b18cd0cbf19b330273a42db","godot_version":"4.7.1.stable.official.a13da4feb"},"schema_version":1,"source_files":[{"bytes":4097,"path":"res://art-src/world/s1/gpt-image-2-source-ledger.json","sha256":"ab26c64e32a3d640d3569d7e2e314017ac3ee3cc686bb50fd5aa91457c49faf8"},{"bytes":723,"path":"res://art-src/world/s1/s1-derived-palette.json","sha256":"0311300b3a8cb3f7ce7d971db4c66ffe24c810cc2127f44286cde4c6640e6795"},{"bytes":4048,"path":"res://art-src/world/s1/s1-world-asset-contract.json","sha256":"3c151deb528a68769d0a06268abe5117d15bcee8c04222024c8ba73cac21bc3e"},{"bytes":4554,"path":"res://art-src/world/s1/s1-world-gpt-image-2-prompts.md","sha256":"a4096a65b44eaaf9fb5066244912c7f0e4ebd4c85da9a72fe76a0e805aeaed68"},{"bytes":1754,"path":"res://docs/media/AUI-10R-REVISION-2-HUMAN-APPROVAL.json","sha256":"a21755ce4e761b51f903d07861d154ae5c618cb4ccabf5b31f652dc8167f2c83"},{"bytes":2238,"path":"res://docs/media/AUI-DESIGN-D-REVISION-CORE-C-BACKDROP-B.json","sha256":"8a0be78a84f0c45f66ac16d5eef5bdb08fc83f212040d5ce696bf42617fa83e6"},{"bytes":1901,"path":"res://docs/media/AUI-DESIGN-D-approved-manifest.json","sha256":"c289a4ef60b2245251e36393d302d704f2e167a83668604a6f4b06da9ab71360"},{"bytes":25057,"path":"res://tools/art_pipeline/world/generate_s1_revision_v2.py","sha256":"1bfd3a2d2dcd35627a3f5d97462e06a8155100823b18cd0cbf19b330273a42db"},{"bytes":29294,"path":"res://tools/art_pipeline/world/normalize_s1_world.py","sha256":"9b79d433f6d690549ca276947fe02b3cd06b49e4c41074fe8e683592b00c7b27"}],"source_type":"ai_assisted_deterministic_normalization"}
