{"acceptance":{"accepted_at_utc":null,"accepting_commit":null,"human_accepter":null,"reason":"current inventory includes later additions or modifications, so no immutable per-asset human acceptance fact was inferred","source":"FEATURES.json:LA records family-level Lane A acceptance at c8ee84d and 218aaea but does not prove every current byte","state":"unknown_per_current_byte"},"final_files":[{"bytes":418,"path":"res://assets/sprites/spellcaster_0.png","sha256":"4dde09b194a506c68d1bfb3e893f154bf70839a4bc64145b48fc7bfe0be533d6"},{"bytes":410,"path":"res://assets/sprites/spellcaster_1.png","sha256":"db04b46c4d4ed93a8fdc98c89712203f40a4878bd7f40bf348cb4b28da32c569"}],"generation":{"generation_id":null,"model":null,"provider":null,"seed":null,"unsupported_reason":"deterministic hand-authored project generator; stochastic provider fields do not apply"},"license":{"human_contribution":"selection, pixel recipes, palette, normalization, and accepted Lane A arrangement","source":"hand-authored deterministic pixel recipes in repository","spdx":"LicenseRef-Project-Owned"},"logical_id":"spellcaster","migration":{"baseline_commit":"975261e8e00a20a0b25fe17e7976d743d509c14b","baseline_tree":"cf4b3e1c0d8ae826c668765d994a032acbb8c0ad","migrated_at_utc":null,"status":"current_bytes_authenticated"},"recipe":{"command":"godot --headless --path . -s tools/gen_assets.gd","generator_path":"res://tools/gen_assets.gd","generator_sha256":"954ce732549be87f12c83eb6ba124181b01739e8edf209b5eefb2e4e2adc6313","godot_version":"4.7.1.stable.official.a13da4feb"},"schema_version":1,"source_files":[{"bytes":6816,"path":"res://assets/asset_manifest.gd","sha256":"7148c49fe10153585be0de7e84fb664955803422621f9040bca6f9e98fa9eae2"},{"bytes":382,"path":"res://data/enemies/spellcaster.tres","sha256":"8820aac6db6ac1ddf8ebf5d0bff45d58eeea6ca47c4cd3673b1f7117d1abc6e4"},{"bytes":696,"path":"res://data/enemy_def.gd","sha256":"f4d103831e58618f0de0f8e178ff40ffb3f198426af01c3871c171d71a1ab40c"},{"bytes":11716,"path":"res://tools/gen_assets.gd","sha256":"954ce732549be87f12c83eb6ba124181b01739e8edf209b5eefb2e4e2adc6313"},{"bytes":7804,"path":"res://tools/pixel/art_enemies.gd","sha256":"6ee123a59aefa7df5a588f3fb32359807058ca2e85f64625b9808dd4bddc99eb"},{"bytes":2949,"path":"res://tools/pixel/palette.gd","sha256":"69664ccdc79bae343c04a6a58ae7614279b49dbb3fa5ecfd4b5d8319cff4d115"},{"bytes":7454,"path":"res://tools/pixel/pix.gd","sha256":"e5d059fb6d20c142f5d32c95c2bf8777f0fe7faf7f864395b8735b3b4e11a88b"}],"source_type":"deterministic_project_generator"}
