{"acceptance":{"accepted_at_utc":null,"accepting_commit":null,"human_accepter":null,"reason":"current inventory includes later additions or modifications, so no immutable per-asset human acceptance fact was inferred","source":"FEATURES.json:LA records family-level Lane A acceptance at c8ee84d and 218aaea but does not prove every current byte","state":"unknown_per_current_byte"},"final_files":[{"bytes":1310,"path":"res://assets/portraits/guard_2.png","sha256":"3bd29a78fde2c5d3d8e172e4a175964e8a4740523de5e5826370385a1c520817"}],"generation":{"generation_id":null,"model":null,"provider":null,"seed":null,"unsupported_reason":"deterministic hand-authored project generator; stochastic provider fields do not apply"},"license":{"human_contribution":"selection, pixel recipes, palette, normalization, and accepted Lane A arrangement","source":"hand-authored deterministic pixel recipes in repository","spdx":"LicenseRef-Project-Owned"},"logical_id":"portrait_guard_2","migration":{"baseline_commit":"975261e8e00a20a0b25fe17e7976d743d509c14b","baseline_tree":"cf4b3e1c0d8ae826c668765d994a032acbb8c0ad","migrated_at_utc":null,"status":"current_bytes_authenticated"},"recipe":{"command":"godot --headless --path . -s tools/gen_assets.gd","generator_path":"res://tools/gen_assets.gd","generator_sha256":"2ba83f67a06e58415bf2d8924a213a71357e32459721089c0d1a47e67e21203d","godot_version":"4.7.1.stable.official.a13da4feb"},"schema_version":1,"source_files":[{"bytes":6816,"path":"res://assets/asset_manifest.gd","sha256":"7148c49fe10153585be0de7e84fb664955803422621f9040bca6f9e98fa9eae2"},{"bytes":1108,"path":"res://data/operator_def.gd","sha256":"d9e4ece407b602d7eb6ba134b642844cf098ed00e5337e78e9230bda8cb4b24f"},{"bytes":570,"path":"res://data/operators/guard_2.tres","sha256":"f20837669e735c2316ea2054d6b7378c5f60d5f2c9503daab8e93a005b259e9b"},{"bytes":10268,"path":"res://tools/gen_assets.gd","sha256":"2ba83f67a06e58415bf2d8924a213a71357e32459721089c0d1a47e67e21203d"},{"bytes":12332,"path":"res://tools/pixel/art_operators.gd","sha256":"888cb858e04ecb33d7df0c009bb565bed43fc77e417b22c52173c76a798eb9e5"},{"bytes":11816,"path":"res://tools/pixel/art_portraits.gd","sha256":"40ad59640417172bac427f875872a4c5b9f249d2eebc5dcde22fb7f44d7e3d9b"},{"bytes":2949,"path":"res://tools/pixel/palette.gd","sha256":"69664ccdc79bae343c04a6a58ae7614279b49dbb3fa5ecfd4b5d8319cff4d115"},{"bytes":7454,"path":"res://tools/pixel/pix.gd","sha256":"e5d059fb6d20c142f5d32c95c2bf8777f0fe7faf7f864395b8735b3b4e11a88b"}],"source_type":"deterministic_project_generator"}
